{"category": 2, "kind": 1, "get_min_bitlen": {}, "default_dtid": 1120, "get_max_bitlen": {}, "union": false, "fields": [{"type": {"category": 0, "kind": 1, "full_name": "saturated uint2", "cast_mode": 0, "value_range": [0, 3], "bitlen": 2}, "name": "state"}, {"type": {"category": 0, "kind": 1, "full_name": "saturated uint30", "cast_mode": 0, "value_range": [0, 1073741823], "bitlen": 30}, "name": "flags"}, {"type": {"bitlen": 16, "category": 3, "full_name": "void16"}, "name": null}, {"type": {"category": 0, "kind": 1, "full_name": "saturated uint7", "cast_mode": 0, "value_range": [0, 127], "bitlen": 7}, "name": "engine_load_percent"}, {"type": {"category": 0, "kind": 1, "full_name": "saturated uint17", "cast_mode": 0, "value_range": [0, 131071], "bitlen": 17}, "name": "engine_speed_rpm"}, {"type": {"category": 0, "kind": 3, "full_name": "saturated float16", "cast_mode": 0, "value_range": [-65504.0, 65504.0], "bitlen": 16}, "name": "spark_dwell_time_ms"}, {"type": {"category": 0, "kind": 3, "full_name": "saturated float16", "cast_mode": 0, "value_range": [-65504.0, 65504.0], "bitlen": 16}, "name": "atmospheric_pressure_kpa"}, {"type": {"category": 0, "kind": 3, "full_name": "saturated float16", "cast_mode": 0, "value_range": [-65504.0, 65504.0], "bitlen": 16}, "name": "intake_manifold_pressure_kpa"}, {"type": {"category": 0, "kind": 3, "full_name": "saturated float16", "cast_mode": 0, "value_range": [-65504.0, 65504.0], "bitlen": 16}, "name": "intake_manifold_temperature"}, {"type": {"category": 0, "kind": 3, "full_name": "saturated float16", "cast_mode": 0, "value_range": [-65504.0, 65504.0], "bitlen": 16}, "name": "coolant_temperature"}, {"type": {"category": 0, "kind": 3, "full_name": "saturated float16", "cast_mode": 0, "value_range": [-65504.0, 65504.0], "bitlen": 16}, "name": "oil_pressure"}, {"type": {"category": 0, "kind": 3, "full_name": "saturated float16", "cast_mode": 0, "value_range": [-65504.0, 65504.0], "bitlen": 16}, "name": "oil_temperature"}, {"type": {"category": 0, "kind": 3, "full_name": "saturated float16", "cast_mode": 0, "value_range": [-65504.0, 65504.0], "bitlen": 16}, "name": "fuel_pressure"}, {"type": {"category": 0, "kind": 3, "full_name": "saturated float32", "cast_mode": 0, "value_range": [-3.4028234663852886e+38, 3.4028234663852886e+38], "bitlen": 32}, "name": "fuel_consumption_rate_cm3pm"}, {"type": {"category": 0, "kind": 3, "full_name": "saturated float32", "cast_mode": 0, "value_range": [-3.4028234663852886e+38, 3.4028234663852886e+38], "bitlen": 32}, "name": "estimated_consumed_fuel_volume_cm3"}, {"type": {"category": 0, "kind": 1, "full_name": "saturated uint7", "cast_mode": 0, "value_range": [0, 127], "bitlen": 7}, "name": "throttle_position_percent"}, {"type": {"category": 0, "kind": 1, "full_name": "saturated uint6", "cast_mode": 0, "value_range": [0, 63], "bitlen": 6}, "name": "ecu_index"}, {"type": {"category": 0, "kind": 1, "full_name": "saturated uint3", "cast_mode": 0, "value_range": [0, 7], "bitlen": 3}, "name": "spark_plug_usage"}, {"type": {"full_name": "uavcan.equipment.ice.reciprocating.CylinderStatus[<=16]", "category": 1, "value_type": {"category": 2, "kind": 1, "get_min_bitlen": {}, "default_dtid": null, "get_max_bitlen": {}, "union": false, "fields": [{"type": {"category": 0, "kind": 3, "full_name": "saturated float16", "cast_mode": 0, "value_range": [-65504.0, 65504.0], "bitlen": 16}, "name": "ignition_timing_deg"}, {"type": {"category": 0, "kind": 3, "full_name": "saturated float16", "cast_mode": 0, "value_range": [-65504.0, 65504.0], "bitlen": 16}, "name": "injection_time_ms"}, {"type": {"category": 0, "kind": 3, "full_name": "saturated float16", "cast_mode": 0, "value_range": [-65504.0, 65504.0], "bitlen": 16}, "name": "cylinder_head_temperature"}, {"type": {"category": 0, "kind": 3, "full_name": "saturated float16", "cast_mode": 0, "value_range": [-65504.0, 65504.0], "bitlen": 16}, "name": "exhaust_gas_temperature"}, {"type": {"category": 0, "kind": 3, "full_name": "saturated float16", "cast_mode": 0, "value_range": [-65504.0, 65504.0], "bitlen": 16}, "name": "lambda_coefficient"}], "_data_type_signature": null, "version": null, "source_text": "#\n# Cylinder state information.\n# This is a nested data type.\n#\n# All unknown parameters should be set to NaN.\n#\n\n#\n# Cylinder ignition timing.\n# Units: angular degrees of the crankshaft.\n#\nfloat16 ignition_timing_deg\n\n#\n# Fuel injection time.\n# Units: millisecond.\n#\nfloat16 injection_time_ms\n\n#\n# Cylinder head temperature (CHT).\n# Units: kelvin.\n#\nfloat16 cylinder_head_temperature\n\n#\n# Exhaust gas temperature (EGT).\n# Set to NaN if this cylinder is not equipped with an EGT sensor.\n# Set this field to the same value for all cylinders if there is a single shared EGT sensor.\n# Units: kelvin.\n#\nfloat16 exhaust_gas_temperature\n\n#\n# Estimated lambda coefficient.\n# This parameter is mostly useful for monitoring and tuning purposes.\n# Unit: dimensionless ratio\n#\nfloat16 lambda_coefficient\n", "full_name": "uavcan.equipment.ice.reciprocating.CylinderStatus", "source_file": "C:\\Users\\michael\\Source\\Repos\\MissionPlanner\\ExtLibs\\UAVCAN\\dsdl\\uavcan\\equipment\\ice\\reciprocating\\CylinderStatus.uavcan", "constants": []}, "mode": 1, "max_size": 16}, "name": "cylinder_status"}], "_data_type_signature": null, "version": null, "source_text": "#\n# Generic status message of a piston engine control system.\n#\n# All integer fields are required unless stated otherwise.\n# All floating point fields are optional unless stated otherwise; unknown/unapplicable fields should be set to NaN.\n#\n\n#\n# Abstract engine state. The flags defined below can provide further elaboration.\n# This is a required field.\n#\nuint2 state\n#\n# The engine is not running. This is the default state.\n# Next states: STARTING, FAULT\n#\nuint2 STATE_STOPPED = 0\n#\n# The engine is starting. This is a transient state.\n# Next states: STOPPED, RUNNING, FAULT\n#\nuint2 STATE_STARTING = 1\n#\n# The engine is running normally.\n# Some error flags may be set to indicate non-fatal issues, e.g. overheating.\n# Next states: STOPPED, FAULT\n#\nuint2 STATE_RUNNING = 2\n#\n# The engine can no longer function.\n# The error flags may contain additional information about the nature of the fault.\n# Next states: STOPPED.\n#\nuint2 STATE_FAULT = 3\n\n#\n# General status flags.\n# Note that not all flags are required. Those that aren't are prepended with a validity flag, which is, obviously,\n# always required; when the validity flag is set, it is assumed that the relevant flags are set correctly.\n# If the validity flag is cleared, then the state of the relevant flags should be ignored.\n# All unused bits must be cleared.\n#\nuint30 flags\n#\n# General error. This flag is required, and it can be used to indicate an error condition\n# that does not fit any of the other flags.\n# Note that the vendor may also report additional status information via the vendor specific status code\n# field of the NodeStatus message.\n#\nuint30 FLAG_GENERAL_ERROR                       = 1\n#\n# Error of the crankshaft sensor. This flag is optional.\n#\nuint30 FLAG_CRANKSHAFT_SENSOR_ERROR_SUPPORTED   = 2\nuint30 FLAG_CRANKSHAFT_SENSOR_ERROR             = 4\n#\n# Temperature levels. These flags are optional; either none of them or all of them are supported.\n#\nuint30 FLAG_TEMPERATURE_SUPPORTED               = 8\nuint30 FLAG_TEMPERATURE_BELOW_NOMINAL           = 16      # Under-temperature warning\nuint30 FLAG_TEMPERATURE_ABOVE_NOMINAL           = 32      # Over-temperature warning\nuint30 FLAG_TEMPERATURE_OVERHEATING             = 64      # Critical overheating\nuint30 FLAG_TEMPERATURE_EGT_ABOVE_NOMINAL       = 128     # Exhaust gas over-temperature warning\n#\n# Fuel pressure. These flags are optional; either none of them or all of them are supported.\n#\nuint30 FLAG_FUEL_PRESSURE_SUPPORTED             = 256\nuint30 FLAG_FUEL_PRESSURE_BELOW_NOMINAL         = 512     # Under-pressure warning\nuint30 FLAG_FUEL_PRESSURE_ABOVE_NOMINAL         = 1024    # Over-pressure warning\n#\n# Detonation warning. This flag is optional.\n# This warning is cleared immediately after broadcasting is done if detonation is no longer happening.\n#\nuint30 FLAG_DETONATION_SUPPORTED                = 2048\nuint30 FLAG_DETONATION_OBSERVED                 = 4096    # Detonation condition observed warning\n#\n# Misfire warning. This flag is optional.\n# This warning is cleared immediately after broadcasting is done if misfire is no longer happening.\n#\nuint30 FLAG_MISFIRE_SUPPORTED                   = 8192\nuint30 FLAG_MISFIRE_OBSERVED                    = 16384   # Misfire condition observed warning\n#\n# Oil pressure. These flags are optional; either none of them or all of them are supported.\n#\nuint30 FLAG_OIL_PRESSURE_SUPPORTED              = 32768\nuint30 FLAG_OIL_PRESSURE_BELOW_NOMINAL          = 65536   # Under-pressure warning\nuint30 FLAG_OIL_PRESSURE_ABOVE_NOMINAL          = 131072  # Over-pressure warning\n#\n# Debris warning. This flag is optional.\n#\nuint30 FLAG_DEBRIS_SUPPORTED                    = 262144\nuint30 FLAG_DEBRIS_DETECTED                     = 524288  # Detection of debris warning\n\n#\n# Reserved space\n#\nvoid16\n\n#\n# Engine load estimate.\n# Unit: percent.\n# Range: [0, 127].\n#\nuint7 engine_load_percent\n\n#\n# Engine speed.\n# Unit: revolutions per minute.\n#\nuint17 engine_speed_rpm\n\n#\n# Spark dwell time.\n# Unit: millisecond.\n#\nfloat16 spark_dwell_time_ms\n\n#\n# Atmospheric (barometric) pressure.\n# Unit: kilopascal.\n#\nfloat16 atmospheric_pressure_kpa\n\n#\n# Engine intake manifold pressure.\n# Unit: kilopascal.\n#\nfloat16 intake_manifold_pressure_kpa\n\n#\n# Engine intake manifold temperature.\n# Unit: kelvin.\n#\nfloat16 intake_manifold_temperature\n\n#\n# Engine coolant temperature.\n# Unit: kelvin.\n#\nfloat16 coolant_temperature\n\n#\n# Oil pressure.\n# Unit: kilopascal.\n#\nfloat16 oil_pressure\n\n#\n# Oil temperature.\n# Unit: kelvin.\n#\nfloat16 oil_temperature\n\n#\n# Fuel pressure.\n# Unit: kilopascal.\n#\nfloat16 fuel_pressure\n\n#\n# Instant fuel consumption estimate.\n# The estimated value should be low-pass filtered in order to prevent aliasing effects.\n# Unit: (centimeter^3)/minute.\n#\nfloat32 fuel_consumption_rate_cm3pm\n\n#\n# Estimate of the consumed fuel since the start of the engine.\n# This variable MUST be reset when the engine is stopped.\n# Unit: centimeter^3.\n#\nfloat32 estimated_consumed_fuel_volume_cm3\n\n#\n# Throttle position.\n# Unit: percent.\n#\nuint7 throttle_position_percent\n\n#\n# The index of the publishing ECU.\n#\nuint6 ecu_index\n\n#\n# Spark plug activity report.\n# Can be used during pre-flight tests of the spark subsystem.\n#\nuint3 spark_plug_usage\n#\nuint3 SPARK_PLUG_SINGLE         = 0\nuint3 SPARK_PLUG_FIRST_ACTIVE   = 1\nuint3 SPARK_PLUG_SECOND_ACTIVE  = 2\nuint3 SPARK_PLUG_BOTH_ACTIVE    = 3\n\n#\n# Per-cylinder status information.\n#\nCylinderStatus[<=16] cylinder_status\n", "full_name": "uavcan.equipment.ice.reciprocating.Status", "source_file": "C:\\Users\\michael\\Source\\Repos\\MissionPlanner\\ExtLibs\\UAVCAN\\dsdl\\uavcan\\equipment\\ice\\reciprocating\\1120.Status.uavcan", "constants": [{"init_expression": "0", "type": {"category": 0, "kind": 1, "full_name": "saturated uint2", "cast_mode": 0, "value_range": [0, 3], "bitlen": 2}, "name": "STATE_STOPPED", "value": 0, "string_value": "0"}, {"init_expression": "1", "type": {"category": 0, "kind": 1, "full_name": "saturated uint2", "cast_mode": 0, "value_range": [0, 3], "bitlen": 2}, "name": "STATE_STARTING", "value": 1, "string_value": "1"}, {"init_expression": "2", "type": {"category": 0, "kind": 1, "full_name": "saturated uint2", "cast_mode": 0, "value_range": [0, 3], "bitlen": 2}, "name": "STATE_RUNNING", "value": 2, "string_value": "2"}, {"init_expression": "3", "type": {"category": 0, "kind": 1, "full_name": "saturated uint2", "cast_mode": 0, "value_range": [0, 3], "bitlen": 2}, "name": "STATE_FAULT", "value": 3, "string_value": "3"}, {"init_expression": "1", "type": {"category": 0, "kind": 1, "full_name": "saturated uint30", "cast_mode": 0, "value_range": [0, 1073741823], "bitlen": 30}, "name": "FLAG_GENERAL_ERROR", "value": 1, "string_value": "1"}, {"init_expression": "2", "type": {"category": 0, "kind": 1, "full_name": "saturated uint30", "cast_mode": 0, "value_range": [0, 1073741823], "bitlen": 30}, "name": "FLAG_CRANKSHAFT_SENSOR_ERROR_SUPPORTED", "value": 2, "string_value": "2"}, {"init_expression": "4", "type": {"category": 0, "kind": 1, "full_name": "saturated uint30", "cast_mode": 0, "value_range": [0, 1073741823], "bitlen": 30}, "name": "FLAG_CRANKSHAFT_SENSOR_ERROR", "value": 4, "string_value": "4"}, {"init_expression": "8", "type": {"category": 0, "kind": 1, "full_name": "saturated uint30", "cast_mode": 0, "value_range": [0, 1073741823], "bitlen": 30}, "name": "FLAG_TEMPERATURE_SUPPORTED", "value": 8, "string_value": "8"}, {"init_expression": "16", "type": {"category": 0, "kind": 1, "full_name": "saturated uint30", "cast_mode": 0, "value_range": [0, 1073741823], "bitlen": 30}, "name": "FLAG_TEMPERATURE_BELOW_NOMINAL", "value": 16, "string_value": "16"}, {"init_expression": "32", "type": {"category": 0, "kind": 1, "full_name": "saturated uint30", "cast_mode": 0, "value_range": [0, 1073741823], "bitlen": 30}, "name": "FLAG_TEMPERATURE_ABOVE_NOMINAL", "value": 32, "string_value": "32"}, {"init_expression": "64", "type": {"category": 0, "kind": 1, "full_name": "saturated uint30", "cast_mode": 0, "value_range": [0, 1073741823], "bitlen": 30}, "name": "FLAG_TEMPERATURE_OVERHEATING", "value": 64, "string_value": "64"}, {"init_expression": "128", "type": {"category": 0, "kind": 1, "full_name": "saturated uint30", "cast_mode": 0, "value_range": [0, 1073741823], "bitlen": 30}, "name": "FLAG_TEMPERATURE_EGT_ABOVE_NOMINAL", "value": 128, "string_value": "128"}, {"init_expression": "256", "type": {"category": 0, "kind": 1, "full_name": "saturated uint30", "cast_mode": 0, "value_range": [0, 1073741823], "bitlen": 30}, "name": "FLAG_FUEL_PRESSURE_SUPPORTED", "value": 256, "string_value": "256"}, {"init_expression": "512", "type": {"category": 0, "kind": 1, "full_name": "saturated uint30", "cast_mode": 0, "value_range": [0, 1073741823], "bitlen": 30}, "name": "FLAG_FUEL_PRESSURE_BELOW_NOMINAL", "value": 512, "string_value": "512"}, {"init_expression": "1024", "type": {"category": 0, "kind": 1, "full_name": "saturated uint30", "cast_mode": 0, "value_range": [0, 1073741823], "bitlen": 30}, "name": "FLAG_FUEL_PRESSURE_ABOVE_NOMINAL", "value": 1024, "string_value": "1024"}, {"init_expression": "2048", "type": {"category": 0, "kind": 1, "full_name": "saturated uint30", "cast_mode": 0, "value_range": [0, 1073741823], "bitlen": 30}, "name": "FLAG_DETONATION_SUPPORTED", "value": 2048, "string_value": "2048"}, {"init_expression": "4096", "type": {"category": 0, "kind": 1, "full_name": "saturated uint30", "cast_mode": 0, "value_range": [0, 1073741823], "bitlen": 30}, "name": "FLAG_DETONATION_OBSERVED", "value": 4096, "string_value": "4096"}, {"init_expression": "8192", "type": {"category": 0, "kind": 1, "full_name": "saturated uint30", "cast_mode": 0, "value_range": [0, 1073741823], "bitlen": 30}, "name": "FLAG_MISFIRE_SUPPORTED", "value": 8192, "string_value": "8192"}, {"init_expression": "16384", "type": {"category": 0, "kind": 1, "full_name": "saturated uint30", "cast_mode": 0, "value_range": [0, 1073741823], "bitlen": 30}, "name": "FLAG_MISFIRE_OBSERVED", "value": 16384, "string_value": "16384"}, {"init_expression": "32768", "type": {"category": 0, "kind": 1, "full_name": "saturated uint30", "cast_mode": 0, "value_range": [0, 1073741823], "bitlen": 30}, "name": "FLAG_OIL_PRESSURE_SUPPORTED", "value": 32768, "string_value": "32768"}, {"init_expression": "65536", "type": {"category": 0, "kind": 1, "full_name": "saturated uint30", "cast_mode": 0, "value_range": [0, 1073741823], "bitlen": 30}, "name": "FLAG_OIL_PRESSURE_BELOW_NOMINAL", "value": 65536, "string_value": "65536"}, {"init_expression": "131072", "type": {"category": 0, "kind": 1, "full_name": "saturated uint30", "cast_mode": 0, "value_range": [0, 1073741823], "bitlen": 30}, "name": "FLAG_OIL_PRESSURE_ABOVE_NOMINAL", "value": 131072, "string_value": "131072"}, {"init_expression": "262144", "type": {"category": 0, "kind": 1, "full_name": "saturated uint30", "cast_mode": 0, "value_range": [0, 1073741823], "bitlen": 30}, "name": "FLAG_DEBRIS_SUPPORTED", "value": 262144, "string_value": "262144"}, {"init_expression": "524288", "type": {"category": 0, "kind": 1, "full_name": "saturated uint30", "cast_mode": 0, "value_range": [0, 1073741823], "bitlen": 30}, "name": "FLAG_DEBRIS_DETECTED", "value": 524288, "string_value": "524288"}, {"init_expression": "0", "type": {"category": 0, "kind": 1, "full_name": "saturated uint3", "cast_mode": 0, "value_range": [0, 7], "bitlen": 3}, "name": "SPARK_PLUG_SINGLE", "value": 0, "string_value": "0"}, {"init_expression": "1", "type": {"category": 0, "kind": 1, "full_name": "saturated uint3", "cast_mode": 0, "value_range": [0, 7], "bitlen": 3}, "name": "SPARK_PLUG_FIRST_ACTIVE", "value": 1, "string_value": "1"}, {"init_expression": "2", "type": {"category": 0, "kind": 1, "full_name": "saturated uint3", "cast_mode": 0, "value_range": [0, 7], "bitlen": 3}, "name": "SPARK_PLUG_SECOND_ACTIVE", "value": 2, "string_value": "2"}, {"init_expression": "3", "type": {"category": 0, "kind": 1, "full_name": "saturated uint3", "cast_mode": 0, "value_range": [0, 7], "bitlen": 3}, "name": "SPARK_PLUG_BOTH_ACTIVE", "value": 3, "string_value": "3"}]}